{
  "schema_version": "1.0",
  "matrix_id": "cloud-security-baseline-overlap",
  "matrix_version": "1.0.0",
  "created_on": "2026-08-13",
  "protocol": {
    "path": "evaluation/protocol-v1.0.json",
    "version": "1.0.0",
    "sha256": "23523b0d79f16cd06604c1db5966ba2b4100c53005e4cb45639870698053977d"
  },
  "corpus": {
    "path": "evaluation/corpus-manifest-v1.0.json",
    "version": "1.0.0",
    "sha256": "9e9eb0f1d5fa84f4926b7665cc5b3738c481a0caa0c11ad55ed4ae4df1142f59"
  },
  "rule_count": 35,
  "baseline_snapshots": [
    {
      "id": "prowler-aws",
      "version": "5.38.0",
      "commit_sha": "b21ddad32c6d9a98eb819f0ccadac8a6792c2837",
      "source_url": "https://github.com/prowler-cloud/prowler/tree/b21ddad32c6d9a98eb819f0ccadac8a6792c2837"
    },
    {
      "id": "sigma-core",
      "version": "r2026-07-01",
      "commit_sha": "552f3fee420ef232a8e5790c4fae591847e32347",
      "source_url": "https://github.com/SigmaHQ/sigma/tree/552f3fee420ef232a8e5790c4fae591847e32347",
      "release_asset_sha256": "45ccbd62cbf0d7ccca6f44eaa010f86bb24f082b5411c5e22c71907e7770ee46"
    }
  ],
  "comparison_policy": "Only exact, equivalent rule-level predicates over retained evidence produce baseline decisions for later agreement metrics. Partial mappings are qualitative, and missing released scope is not a disagreement.",
  "rows": [
    {
      "lab_rule_id": "IAM-001",
      "module": "iam",
      "baseline_id": "prowler-aws",
      "baseline_check_ids": [
        "iam_aws_attached_policy_no_administrative_privileges",
        "iam_customer_attached_policy_no_administrative_privileges",
        "iam_customer_unattached_policy_no_administrative_privileges",
        "iam_inline_policy_no_administrative_privileges"
      ],
      "relationship": "partial",
      "predicate_direction": "incomparable",
      "comparison_eligible": false,
      "source_urls": [
        "https://github.com/prowler-cloud/prowler/blob/b21ddad32c6d9a98eb819f0ccadac8a6792c2837/prowler/providers/aws/services/iam/iam_aws_attached_policy_no_administrative_privileges/iam_aws_attached_policy_no_administrative_privileges.py",
        "https://github.com/prowler-cloud/prowler/blob/b21ddad32c6d9a98eb819f0ccadac8a6792c2837/prowler/providers/aws/services/iam/iam_customer_attached_policy_no_administrative_privileges/iam_customer_attached_policy_no_administrative_privileges.py",
        "https://github.com/prowler-cloud/prowler/blob/b21ddad32c6d9a98eb819f0ccadac8a6792c2837/prowler/providers/aws/services/iam/iam_customer_unattached_policy_no_administrative_privileges/iam_customer_unattached_policy_no_administrative_privileges.py",
        "https://github.com/prowler-cloud/prowler/blob/b21ddad32c6d9a98eb819f0ccadac8a6792c2837/prowler/providers/aws/services/iam/iam_inline_policy_no_administrative_privileges/iam_inline_policy_no_administrative_privileges.py"
      ],
      "rationale": "Both identify administrative policy breadth, but their decision units and policy algebra differ.",
      "semantic_differences": [
        "The lab requires one explicit Allow statement with Action and Resource both equal to a full wildcard.",
        "Prowler aggregates policy statements, recognizes alternate broad resource forms and NotAction, and reports policy resources rather than lab principals."
      ]
    },
    {
      "lab_rule_id": "IAM-002",
      "module": "iam",
      "baseline_id": "prowler-aws",
      "baseline_check_ids": [
        "iam_aws_attached_policy_no_administrative_privileges",
        "iam_customer_attached_policy_no_administrative_privileges",
        "iam_customer_unattached_policy_no_administrative_privileges",
        "iam_inline_policy_no_administrative_privileges",
        "iam_policy_no_full_access_to_cloudtrail",
        "iam_policy_no_full_access_to_kms",
        "iam_inline_policy_no_full_access_to_cloudtrail",
        "iam_inline_policy_no_full_access_to_kms"
      ],
      "relationship": "partial",
      "predicate_direction": "incomparable",
      "comparison_eligible": false,
      "source_urls": [
        "https://github.com/prowler-cloud/prowler/blob/b21ddad32c6d9a98eb819f0ccadac8a6792c2837/prowler/providers/aws/services/iam/iam_aws_attached_policy_no_administrative_privileges/iam_aws_attached_policy_no_administrative_privileges.py",
        "https://github.com/prowler-cloud/prowler/blob/b21ddad32c6d9a98eb819f0ccadac8a6792c2837/prowler/providers/aws/services/iam/iam_customer_attached_policy_no_administrative_privileges/iam_customer_attached_policy_no_administrative_privileges.py",
        "https://github.com/prowler-cloud/prowler/blob/b21ddad32c6d9a98eb819f0ccadac8a6792c2837/prowler/providers/aws/services/iam/iam_customer_unattached_policy_no_administrative_privileges/iam_customer_unattached_policy_no_administrative_privileges.py",
        "https://github.com/prowler-cloud/prowler/blob/b21ddad32c6d9a98eb819f0ccadac8a6792c2837/prowler/providers/aws/services/iam/iam_inline_policy_no_administrative_privileges/iam_inline_policy_no_administrative_privileges.py",
        "https://github.com/prowler-cloud/prowler/blob/b21ddad32c6d9a98eb819f0ccadac8a6792c2837/prowler/providers/aws/services/iam/iam_policy_no_full_access_to_cloudtrail/iam_policy_no_full_access_to_cloudtrail.py",
        "https://github.com/prowler-cloud/prowler/blob/b21ddad32c6d9a98eb819f0ccadac8a6792c2837/prowler/providers/aws/services/iam/iam_policy_no_full_access_to_kms/iam_policy_no_full_access_to_kms.py",
        "https://github.com/prowler-cloud/prowler/blob/b21ddad32c6d9a98eb819f0ccadac8a6792c2837/prowler/providers/aws/services/iam/iam_inline_policy_no_full_access_to_cloudtrail/iam_inline_policy_no_full_access_to_cloudtrail.py",
        "https://github.com/prowler-cloud/prowler/blob/b21ddad32c6d9a98eb819f0ccadac8a6792c2837/prowler/providers/aws/services/iam/iam_inline_policy_no_full_access_to_kms/iam_inline_policy_no_full_access_to_kms.py"
      ],
      "rationale": "Prowler has administrative and selected full-service checks related to wildcard actions.",
      "semantic_differences": [
        "The lab flags full, service-wide, and partial wildcard syntax for every AWS service without requiring Resource to be global.",
        "Prowler evaluates effective administrative or complete CloudTrail and KMS access on all resources, including policy combinations without a literal wildcard action."
      ]
    },
    {
      "lab_rule_id": "IAM-003",
      "module": "iam",
      "baseline_id": "prowler-aws",
      "baseline_check_ids": [
        "iam_aws_attached_policy_no_administrative_privileges",
        "iam_customer_attached_policy_no_administrative_privileges",
        "iam_customer_unattached_policy_no_administrative_privileges",
        "iam_inline_policy_no_administrative_privileges",
        "iam_policy_no_full_access_to_cloudtrail",
        "iam_policy_no_full_access_to_kms",
        "iam_inline_policy_no_full_access_to_cloudtrail",
        "iam_inline_policy_no_full_access_to_kms"
      ],
      "relationship": "partial",
      "predicate_direction": "incomparable",
      "comparison_eligible": false,
      "source_urls": [
        "https://github.com/prowler-cloud/prowler/blob/b21ddad32c6d9a98eb819f0ccadac8a6792c2837/prowler/providers/aws/services/iam/iam_aws_attached_policy_no_administrative_privileges/iam_aws_attached_policy_no_administrative_privileges.py",
        "https://github.com/prowler-cloud/prowler/blob/b21ddad32c6d9a98eb819f0ccadac8a6792c2837/prowler/providers/aws/services/iam/iam_customer_attached_policy_no_administrative_privileges/iam_customer_attached_policy_no_administrative_privileges.py",
        "https://github.com/prowler-cloud/prowler/blob/b21ddad32c6d9a98eb819f0ccadac8a6792c2837/prowler/providers/aws/services/iam/iam_customer_unattached_policy_no_administrative_privileges/iam_customer_unattached_policy_no_administrative_privileges.py",
        "https://github.com/prowler-cloud/prowler/blob/b21ddad32c6d9a98eb819f0ccadac8a6792c2837/prowler/providers/aws/services/iam/iam_inline_policy_no_administrative_privileges/iam_inline_policy_no_administrative_privileges.py",
        "https://github.com/prowler-cloud/prowler/blob/b21ddad32c6d9a98eb819f0ccadac8a6792c2837/prowler/providers/aws/services/iam/iam_policy_no_full_access_to_cloudtrail/iam_policy_no_full_access_to_cloudtrail.py",
        "https://github.com/prowler-cloud/prowler/blob/b21ddad32c6d9a98eb819f0ccadac8a6792c2837/prowler/providers/aws/services/iam/iam_policy_no_full_access_to_kms/iam_policy_no_full_access_to_kms.py",
        "https://github.com/prowler-cloud/prowler/blob/b21ddad32c6d9a98eb819f0ccadac8a6792c2837/prowler/providers/aws/services/iam/iam_inline_policy_no_full_access_to_cloudtrail/iam_inline_policy_no_full_access_to_cloudtrail.py",
        "https://github.com/prowler-cloud/prowler/blob/b21ddad32c6d9a98eb819f0ccadac8a6792c2837/prowler/providers/aws/services/iam/iam_inline_policy_no_full_access_to_kms/iam_inline_policy_no_full_access_to_kms.py"
      ],
      "rationale": "Prowler administrative and full-service checks also consider wildcard resource scope.",
      "semantic_differences": [
        "The lab flags any allowed action whose Resource is a full wildcard.",
        "Prowler requires administrative or selected full-service effective access and can aggregate multiple statements or NotAction constructs."
      ]
    },
    {
      "lab_rule_id": "IAM-004",
      "module": "iam",
      "baseline_id": "prowler-aws",
      "baseline_check_ids": [],
      "relationship": "none",
      "predicate_direction": "no-counterpart",
      "comparison_eligible": false,
      "source_urls": [
        "https://github.com/prowler-cloud/prowler/tree/b21ddad32c6d9a98eb819f0ccadac8a6792c2837/prowler/providers/aws/services/iam"
      ],
      "rationale": "No Prowler AWS 5.38.0 IAM check evaluates the lab's generic broad S3 write predicate.",
      "semantic_differences": [
        "The released provider has no directly comparable retained-evidence predicate."
      ]
    },